Preces IV;Prières litaniques IV
V/.Dicámus omnes ex toto corde et ex tota mente : Kýrie eléison. R/. Kýrie eléison.;"V/. Disons de tout notre c&oelig;ur et de toute notre âme : Kýrie Eleison.  R/. Kýrie eleison. "
V/.Pro supérna pace et tranquillitáte témporum nostrórum, orámus te.;V/. Pour obtenir la paix qui vient d'en haut et la tranquillité des temps que nous vivons, nous te prions.
V/.Pro hoc loco et habitántibus in eo atque peregrinántibus, iter agéntibus et navigántibus, orámus te.;V/. Pour ce lieu et ceux qui l'habitent, pour ceux qui sont à l'étranger, pour tous ceux qui sont sur les chemins de la terre, de l'air et de la mer, nous te prions. 
V/.Christiánum ac pacíficum nobis finem cóncedi a Dómino comprecémur.;V/. Demandons au Seigneur de nous acorder une fin chrétienne et paisible.
V/.Pro (fratre nostro N. / soróre nostra N. et) ómnibus ubíque terrárum in Christo quiescentibus, orámus te.;"V/. Pour (notre frère ou notre s&oelig;ur N et) tous ceux qui sur la terre entière, reposent dans le Christ, nous te prions."
V/.Et divínum in nobis permanére vínculum caritátis Deum comprecémur.;V/. Demandons à Dieu de maintenir en nous le lien divin de la charité.
V/. Sanctæ Dei Genetrícis semperque Vírginis Maríae et sanctórum ómnium memóriam recólimus, ut, orántibus eis pro nobis, véniam a Dómino mereámur.;V/. Faisons mémoire de la sainte Mère de Dieu, Marie toujours vierge, et de tous les saints afin que leur prière nous mérite la faveur de Dieu.
