Preces XV;Prières litaniques XV
V/. Nos, pópulus tuus et Ecclésia tua, Dómine, per Fílium tuum te Patrem orámus dicéntes : Te rogámus, audi nos. R/. Te rogámus, audi nos.;"V/. Seigneur, nous sommes ton peuple et ton Église ; nous te prions par ton Fils, ô Père, en disant : De grâce, écoute-nous. R/. De grâce, écoute-nous."
V/. Ecclésiæ tuæ fundaméntum fídei confírma.;V/. Affermis le fondement de la foi de ton Église.
V/. Pópulo tuo caritátis concordiam radícitus ínsere.;V/. Enracine profondément dans ton peuple l'harmonie de la charité. 
V/. Pastóres róbora, eos qui pascúntur secúros præsta.;V/. Fortifie les pasteurs, assure la sécurité du troupeau. 
V/. Infidéles convérte, schísmata cómprime, hæresium frémitus exstíngue.;V/. Convertis les incroyants, réduis les divisions, éteins le trouble des hérésies.
V/. In extrémo agóne pósitos ádiuva, (fratrem nostrum / sorórem nostram N. et omnes) in purgatório doléntes ad cælum súbleva.;V/. Secours les agonisants, transporte au ciel (notre frère ou notre soeur N. et tous) ceux qui souffrent dans le purgatoire.
V/. Et nos omnes concórditer in viam pii tui cultus dírige.;V/. Et fais-nous marcher tous, d'un seul coeur, dans la voie de ton service saint.
V/. Et dignos éffice, ut sanctificáta consciéntia, puro desidério atque bona fidúcia audeámus invocáre.;V/. Sanctifie notre conscience, purifie notre désir et accrois notre confiance, pour que nous osions te dire :
