"Canticum (Ap 4,11; 5, 9.10.12) NT9";"Canticum (Ap 4,11; 5, 9.10.12) NT9"
Hymnus redemptorum;Hymne du rédempteur 


Dignus es, Dómine et Deus noster, * accípere glóriam et honórem et virtútem,;Tu es digne, Seigneur notre Dieu, de recevoir l'honneur, la gloire et la puissance.
quia tu creásti ómnia, * et propter voluntátem tuam erant et creáta sunt.;"C'est toi qui créas l'univers; tu as voulu qu'il soit: il fut créé."
Dignus es, Dómine, accípere librum * et aperíre signácula eius,;Tu es digne, Christ et Seigneur, de prendre le Livre et d'en ouvrir les sceaux.
quóniam occísus es et redemísti Deo in sánguine tuo * ex omni tribu et língua et pópulo et natióne;Car tu fus immolé, rachetant pour Dieu, au prix de ton sang, des hommes de toute tribu, langue, peuple et nation.
et fecísti eos Deo nostro regnum et sacerdótes, * et regnábunt super terram.;Tu as fait de nous, pour notre Dieu, un royaume et des prêtres, et nous régnerons sur la terre.
Dignus est Agnus, qui occísus est, accípere virtútem et divítias et sapiéntiam * et fortitúdinem et honórem et glóriam et benedictiónem.;Il est digne, l'Agneau immolé, de recevoir puissance et richesse, sagesse et force, honneur, gloire et louange.
