Psalmus 122 (123) ;Psaume 122 (123) 
Dominus fiducia populi;Le Seigneur, confiance du peuple
Duo cæci... clamaverunt: «Domine, miserere nostri, Fili David» (Mt 20, 30).;Deux aveugles… crièrent »Seigneur, prends pitié de nous, Fils de David » (Mt 20, 30).

Ad te levávi óculos meos, * qui hábitas in cælis.;J'élève mes yeux vers toi, ô toi qui siège dans les cieux!
Ecce sicut óculi servórum ad manus dominórum suórum, * icut óculi ancíllæ ad manus dóminæ suæ,;Comme l'oeil du serviteur est fixé sur la main de son maître,  et l'oeil de la servante sur la main de sa maîtresse,
ita óculi nostri ad Dóminum Deum nostrum, * donec misereátur nostri.;ainsi nos yeux sont fixés sur le Seigneur, notre Dieu, jusqu'à ce qu'il ait pitié de nous.
"Miserére nostri, Dómine, miserére nostri, * quia multum repléti sumus despectióne;"; Aie pitié de nous, le Seigneur, aie pitié de nous, car nous n'avons été que trop rassasiés d'opprobres.
quia multum repléta est ánima nostra * derisióne abundántium et despectióne superbórum.;Notre âme n'a été que trop rassasiée de la moquerie des superbes, du mépris des orgueilleux.
