intitule;Dominica XX per annum;XXe dimanche du Temps Ordinaire
pmagnificat;Nolite solliciti esse dicentes: Quid manducabimus, aut quid bibemus? Scit enim Pater vester cælestis quid vobis necesse sit. ;
oratio;Deus, qui diligéntibus te bona invisibília præparásti, + infúnde córdibus nostris tui amóris afféctum, * ut, te in ómnibus et super ómnia diligéntes, promissiones tuas, quæ omne desidérium súperant, consequámur. Per Christum.;Pour ceux qui t'aiment, ô Dieu, tu as préparé de biens que l'œil ne peut voir : répands en nos cœurs la ferveur de ton amour, afin que, t'aimant en toute chose et par-dessus tout, nous obtenions la réalisation de tes promesses qui surpassent tout désir.
benedictus_A;Egressus Iesus secessit in partes Tyri et Sidonis: et ecce mulier Chananæa a finibus illis egressa, clamabat dicens: Miserere mei, Domine Fili David.;
benedictus_B;Ego sum panis vivus, qui de caelo descendi: si quis manducaverit ex hoc pane, vivet in æternum, alleluia.;
benedictus_C;In patientia vestra possidebitis animas vestras.;
magnificat_A; O mulier, magna est fides tua: fiat tibi sicut petisti;
magnificat_B;Sapientia ædificavit sibi domum, miscuit vinum, et posuit mensam, alleluia.;
magnificat_C;Ignem veni mittere in terram, et quid volo nisi ut accendatur.;
