Lectio (He 4, 1-13);Lecture (PG 43, 439 . 451 . 462-463)
<h1>Ex antíqua Homilía in sancto et magno Sábbato</h1>;<h1>Homélie ancienne pour le grand et saint Samedi</h1>
"Expergíscere, qui dormis Quid istud rei est ? Hódie siléntium magnum in terra siléntium magnum, et solitúdo deínceps siléntium magnum, quóniam Rex dormit terra tímuit et quiévit, quóniam Deus in carne obdormívit, et a sæculo dormiéntes excitávit. Deus in carne mórtuus est, et inférnum 
Profécto primum paréntem tamquam pérditam ovem quæsítum vadit. Omníno in ténebris et in umbra mortis sedéntes invísere vult omníno captívum Adam, unáque captívam Evam, ex dolóribus solútum vadit Deus illiúsque Fílius.
Ingréssus est Dóminus ad eos, victrícia arma crucis tenens. Quem ubi vidit Adam primus parens, præ stupóre pectus vérberans, exclamávit ad omnes dixítque : « Dóminus meus cum ómnibus ». Et respóndens Christus dicit Adámo : « Et cum spíritu tuo ». Et apprehénsa manu éxcitat, dicens : « Expergíscere, qui dormis, et surge a mórtuis, et illucéscet tibi Christus.
Ego Deus tuus, qui propter te factus sum fílius tuus ; qui propter te, et propter hos, qui a te oriúndi sunt, nunc dico, et per potestátem ímpero iis qui in vínculis erant : Exíte ; et qui in ténebris : Illuminámini ; et sopítis : Resúrgite. »
";"Éveille-toi, ô toi qui dors  Que se passe-t-il ? Aujourd’hui, grand silence sur la terre ; grand silence et ensuite solitude parce que le Roi sommeille. La terre a tremblé et elle s’est apaisée, parce que Dieu s’est endormi dans la chair et il a éveillé ceux qui dorment depuis les origines. Dieu est mort dans la chair et le séconcitávit. jour des morts s’est mis à trembler.
C’est le premier homme qu’il va chercher, comme la brebis perdue. Il veut aussi visiter ceux qui demeurent dans les ténèbres et dans l’ombre de la mort. Oui, c’est vers Adam captif, en même temps que vers Ève, captive elle aussi, que Dieu se dirige, et son Fils avec lui, pour les délivrer de leurs douleurs.
Le Seigneur s’est avancé vers eux, muni de  la croix, l’arme de sa victoire. Lorsqu’il le vit, Adam, le premier homme, se frappant la poitrine dans sa stupeur, s’écria vers tous les autres : « Mon Seigneur avec nous tous ! » Et le Christ répondit à Adam : « Et avec ton esprit ». Il le prend par la main et le relève en disant : « Éveille-toi, ô toi qui dors, relève-toi d’entre les morts, et le Christ t’illuminera.
C’est moi ton Dieu, qui, pour toi, suis devenu ton fils ; c’est moi qui, pour toi et pour tes descendants, te parle maintenant et qui, par ma puissance, ordonne à ceux qui sont dans les chaînes : Sortez. À ceux qui sont dans les ténèbres : Soyez illuminés. À ceux qui sont endormis : Relevezvous.»"
